video_id,channel_title,video_publish_date,video_title,video_view_count,video_comment_count,video_like_count,video_dislike_count
u3Iqp1tzBJg,Real Engineering,2024-10-09 16:33:44+00:00,Hurricane Milton Has Put NASA’s Next Mission in Danger,95229,173,7156,
Dsk0aIRrHb4,Real Engineering,2024-10-05 13:05:00+00:00,The Problems with China's Space Program,1533866,4775,47884,
glr-0t9K92A,Real Engineering,2024-10-02 16:00:16+00:00,The Wildest Take-off of my Life,1307065,630,70556,
FGf6ab8fcyw,Real Engineering,2024-10-01 12:43:47+00:00,This is the Craziest Plane I Have Ever Seen,562559,318,24602,
QsYYNk-EeJA,Real Engineering,2024-09-07 13:00:25+00:00,This Plane Takes off with Rockets,526643,875,25660,
9iCKhW1d1go,Real Engineering,2024-09-03 13:05:16+00:00,She’s Wrong,133797,532,10514,
-45xHzAej_s,Real Engineering,2024-09-02 16:48:19+00:00,This Weird Noise Coming from Starliner,274137,632,12885,
tCDY1k1JGqw,Real Engineering,2024-08-07 12:30:30+00:00,Revolutionizing the Logistics of Spaceflight - Firefly Aerospace,534171,1158,18330,
EWtrzytNOTk,Real Engineering,2024-07-10 17:47:55+00:00,This Clock Helped Win the Battle of Britain,61014,29,3090,
G5uX1H3lyyI,Real Engineering,2024-07-06 13:00:13+00:00,How the F-117 was shot down,108683,180,5611,
KB4mH03feN4,Real Engineering,2024-07-05 13:00:17+00:00,How the F-117s Weapons Work,327543,248,21290,
IjJXHGZ2yTA,Real Engineering,2024-07-04 13:00:15+00:00,Why the F-117’s has Weird Exhausts,186812,174,12360,
Jb9Jx0KkJl8,Real Engineering,2024-07-03 13:00:27+00:00,The F-117’s weirdest feature,1204784,1050,59323,
LklUVkMPl8g,Real Engineering,2024-06-29 13:00:18+00:00,The Problem with Wind Energy,2768496,5805,73799,
rfcQDh9C5qM,Real Engineering,2024-06-12 13:00:54+00:00,Space Shuttle Astronaut Describes the Sound of Launch,2889642,1700,115503,
69MgN2j7Jwc,Real Engineering,2024-06-11 13:00:05+00:00,Solid Rocket Boosters Were A Bold Choice,1504492,954,62653,
SLdoQr2egkU,Real Engineering,2024-06-10 13:00:21+00:00,The final moments before launch,236564,135,10875,
1zjcnnx7igc,Real Engineering,2024-06-08 13:00:02+00:00,The Insane Engineering of the F-117 Nighthawk,3135681,2383,72995,
v8-bFqw9hFo,Real Engineering,2024-06-05 13:01:05+00:00,NASA has plans to build an even bigger space telescope,75300,102,4554,
EOJzpZ__9s8,Real Engineering,2024-06-02 16:38:45+00:00,Why the GameBoy won,62733,74,3473,
raCo7LpqKWc,Real Engineering,2024-05-26 13:00:45+00:00,Do Maglev Trains Make Sense in America?,579640,1578,32286,
orLpzaqjr6o,Real Engineering,2024-05-25 13:00:41+00:00,Japanese Trains Have Always Been One Step Ahead,66810,81,3581,
TyUUm7PjTKs,Real Engineering,2024-05-24 13:00:34+00:00,Why This Maglev Train is Unstable,356709,252,22543,
XtUQo-tN3Ps,Real Engineering,2024-05-23 15:07:45+00:00,Why This Japanese Train is Revolutionary,70944,108,4196,
I1ixCSAc3bc,Real Engineering,2024-05-06 12:05:09+00:00,The Worst Oil Disaster Ever,1164219,1335,42647,
nyG8XAmtYeQ,Real Engineering,2024-04-23 13:00:42+00:00,Why Airport Security Suddenly Got Better,1898005,2441,57721,
72yYvLLryus,Real Engineering,2024-04-22 18:32:26+00:00,The World’s First Intercity Maglev Train,1116476,1309,63744,
tdVa_o_a270,Real Engineering,2024-04-17 13:00:47+00:00,The Spitfire Guns Packed Some Serious Power,42223,31,2422,
R-qtEh-KluE,Real Engineering,2024-04-16 13:00:20+00:00,Spitfire vs. BF-109,110470,236,7878,
mFS70HPB7Ac,Real Engineering,2024-04-15 13:00:40+00:00,Why the Spitfire had an Elliptical Wing,394951,472,24659,
y9U8CyBD1wQ,Real Engineering,2024-04-13 17:13:20+00:00,The Spitfire is an Icon,67864,111,5247,
U0u_QyurfXA,Real Engineering,2024-04-13 16:45:31+00:00,How the Battle of Britain was Won,220898,177,14072,
Dr-HlIR481I,Real Engineering,2024-04-05 13:00:18+00:00,The F-35s Stealthy Radar is the key to its success,720289,965,49010,
WXfU18JizZM,Real Engineering,2024-04-04 13:00:26+00:00,The F-35s Secret Weapon is Incredible,9052378,8449,368823,
4bvMkkDw5Wg,Real Engineering,2024-04-03 13:00:04+00:00,How the F-35’s engine is better than the F-22’s,563260,620,30801,
j1nJ-A0coHI,Real Engineering,2024-04-02 13:00:38+00:00,Why the F-35 excels in battle,221971,524,14371,
EXag4nsWYoU,Real Engineering,2024-04-01 13:00:20+00:00,F-35 vertical take off is incredible,2019650,2243,100212,
BKm45Az02YE,Real Engineering,2024-03-30 13:00:09+00:00,The Insane Engineering of the Gameboy,2009223,2787,74981,
eaFyTIsowqY,Real Engineering,2024-03-20 18:39:26+00:00,Starship Reached Space. What Now?,1018315,3555,41433,
ngfGcyS-MTM,Real Engineering,2024-03-20 14:00:47+00:00,The F-16s Gun Sounds Amazing,16207449,5972,763520,
WMlZPHRImf0,Real Engineering,2024-03-19 14:00:33+00:00,How the F-16s Leading Edge Flap Works,195855,132,11995,
ZmgpudUU7XQ,Real Engineering,2024-03-18 14:00:29+00:00,How the F-16 flies at extreme AOA,303015,174,16166,
3Ef6BGqgvv4,Real Engineering,2024-03-17 14:00:02+00:00,What’s the bulge in tank guns for?,4467612,2952,246845,
xdnyFG7V79Q,Real Engineering,2024-03-16 14:00:59+00:00,How Ceramic Tank Armor Works,702582,166,21623,
sRBZ9wSHE3g,Real Engineering,2024-03-12 14:00:51+00:00,I'm Happy Hermeus Let Me Upload This,292873,430,11968,
UyKtxsdI0z8,Real Engineering,2024-02-29 18:00:25+00:00,Could This Be The Next Air Force One? - Hermeus,3595301,3947,67184,
JirS1i7GoaE,Real Engineering,2024-02-21 14:00:13+00:00,How this tank makes a smoke screen,254927,165,11467,
Z3x8Z7cOY6w,Real Engineering,2024-02-20 14:00:34+00:00,How the M1 Turbine Engine Works,189219,66,5251,
sk6f0JTAQWY,Real Engineering,2024-02-19 14:00:47+00:00,The M1 Abrams Sounds Crazy,2864783,3334,145699,
bPfDdjUnG1A,Real Engineering,2024-02-01 14:00:35+00:00,The Space Shuttle’s Heat Shield Was Glued On With This Material,133247,129,8629,
ivLX9o6Ayl8,Real Engineering,2024-02-01 12:00:43+00:00,The Insane Engineering of Re-Entry,2578028,2268,57050,
qtOlzyc4v8Q,Real Engineering,2024-01-26 09:30:11+00:00,Massive Abandoned Towers in Austria,1451645,2035,93229,
hhT4M0UjJcg,Real Engineering,2024-01-22 14:00:36+00:00,The Questionable Engineering of the 737 Max,1794659,4856,65768,
9MxT16L9abY,Real Engineering,2024-01-20 14:00:07+00:00,Fixing the P-47s Climb Rate,780935,506,46222,
sBBDfgwUeqo,Real Engineering,2024-01-18 14:00:46+00:00,How Water Injection Increases Horsepower,545197,686,45121,
3rRwyQaawcs,Real Engineering,2024-01-17 14:01:01+00:00,How the P-47s Turbocharger Worked,191797,138,15264,
ceT5npyXeNs,Real Engineering,2024-01-16 14:00:35+00:00,The Chonkiest WW2 Fighter Plane,3035835,1800,160567,
Q93GstSJApQ,Real Engineering,2024-01-11 14:00:18+00:00,How the SR-71's Engine Worked,3664287,966,257666,
iRupCpvLqTk,Real Engineering,2024-01-06 18:18:25+00:00,The A-10s massive gun halves forward thrust,1274751,1307,88221,
0K1pITq4mSk,Real Engineering,2023-12-28 14:01:22+00:00,How Nebula Works,416817,1147,22654,
INIpzE20d3Y,Real Engineering,2023-12-22 14:00:11+00:00,The Insane Engineering of Orbit,1955310,1315,43341,
G-6xOsXigw8,Real Engineering,2023-12-19 20:42:15+00:00,An Astronaut Chokes on His First Job in Space,235645,147,9567,
UcBc0l7IrZU,Real Engineering,2023-12-16 14:30:11+00:00,The Insane Engineering of the Space Shuttle,1103155,1413,35151,
SU0YDwdUE-s,Real Engineering,2023-11-20 17:02:21+00:00,This Experimental Plane Crashed in 1956 - Bell X-2,111202,71,5268,
EhhOin2p5Qs,Real Engineering,2023-11-04 13:00:13+00:00,The Insane Engineering of the F-16,4067294,3542,86584,
ym1MkJBmPyo,Real Engineering,2023-10-22 11:01:20+00:00,A Ukrainian Tractor Modified to Clear Mines,320837,303,15181,
aWv5Itf2e8Y,Real Engineering,2023-10-21 12:00:03+00:00,The Painful Challenge of Demining Ukraine,685944,1391,27207,
wfrF-2LzK6I,Real Engineering,2023-10-09 10:32:10+00:00,The First Plane To Travel Supersonic,104198,125,6141,
tuEYQvEYR-M,Real Engineering,2023-09-30 12:00:40+00:00,The Incredible Potential of Superconductors,606900,556,24538,
qdJ_gJ_kPEI,Real Engineering,2023-09-09 13:00:41+00:00,NASA's Plan to Build A Telescope on the Moon,1149211,2157,32564,
S4L_0CDsd1I,Real Engineering,2023-08-19 13:00:15+00:00,How Japan's Maglev Train Works,2584160,2191,46630,
83i-t8Ouk_0,Real Engineering,2023-08-05 11:30:03+00:00,How Hypersonic Wind Tunnels Work,918761,1416,37827,
INl3pCXm6Tw,Real Engineering,2023-07-22 12:00:12+00:00,The Uncertain Future of Nuclear Power,1008281,3614,38889,
6LcGrLnzYuU,Real Engineering,2023-07-08 12:00:03+00:00,The Questionable Engineering of Oceangate,4364761,9476,146545,
gF9kkB0UWYQ,Real Engineering,2023-06-30 12:00:23+00:00,Why Germany Hates Nuclear Power,2330766,15526,77373,
Dtocpvv88gQ,Real Engineering,2023-06-03 12:00:07+00:00,The Secret Invention That Changed World War 2,2626124,2204,71781,
cOskHgQxxfI,Real Engineering,2023-05-18 19:46:22+00:00,I hate this,163339,347,8339,
NlYXqRG7lus,Real Engineering,2023-05-07 13:36:33+00:00,The Insane Engineering of MRI Machines,3110629,2578,85891,
NR5pWBy-6Fk,Real Engineering,2023-04-22 13:00:10+00:00,The Insane Engineering of the M1 Abrams,6235698,7267,105246,
RVxgyz_avQM,Real Engineering,2023-04-01 13:00:39+00:00,How NASA Reinvented the Rocket Engine,2131876,2052,66125,
_FFNz2q7F88,Real Engineering,2023-03-11 14:00:32+00:00,Don’t Drop your Tools in Space,2405265,2450,35460,
W4EMf_MTXVc,Real Engineering,2023-02-18 14:30:06+00:00,This Gun Could Reach Space,2500125,1659,39650,
Qb_MWOjD57Y,Real Engineering,2023-02-07 16:35:35+00:00,A Private Jet with a Parachute,3367809,2436,156116,
1lCOgFPtaZ4,Real Engineering,2023-01-28 14:00:02+00:00,The Insane Engineering of the F-35B,7832322,9352,154916,
_bDXXWQxK38,Real Engineering,2022-12-17 14:35:48+00:00,A New Way to Achieve Nuclear Fusion: Helion,7397384,15436,202661,
BzK0ydOF0oU,Real Engineering,2022-12-11 16:00:05+00:00,The Problem with Nuclear Fusion,3946710,7028,107036,
n3ncfcGMo50,Real Engineering,2022-11-19 16:01:28+00:00,How Do Seatbelts Work?,976575,1189,32271,
dLirH3PPrXQ,Real Engineering,2022-10-29 13:52:51+00:00,The Insane Engineering of the DART Mission,597196,1087,27497,
_m6SEKNgxno,Real Engineering,2022-10-08 12:00:27+00:00,The Insane Engineering of the Spitfire,4564833,3044,97741,
73mXXJpEjRI,Real Engineering,2022-09-17 13:00:05+00:00,The Truth about Deep Sea Mining,1907549,2973,40885,
0waPJXaZgEg,Real Engineering,2022-08-28 13:30:47+00:00,The SLS is Outdated. Why Does it Exist?,1029073,4011,39710,
yrc632oilWo,Real Engineering,2022-08-06 11:30:13+00:00,Can We Throw Satellites to Space? - SpinLaunch,4148085,14795,106818,
DCo2PgWSB_U,Real Engineering,2022-08-04 12:28:26+00:00,Testing a Space Catapult Airlock - SpinLaunch #shorts,197567,374,9274,
0k9wIsKKgqo,Real Engineering,2022-07-10 12:00:00+00:00,The Problem with the Next Moon Mission,4437421,14181,96679,
br1p4fcqa4s,Real Engineering,2022-06-16 15:08:27+00:00,Zipline Just Reinvented Autonomous Flight #Shorts,828995,579,42745,
8Oi8ZO-2Kvc,Real Engineering,2022-06-04 13:00:02+00:00,What Actually Happened to the Concorde,1412202,1621,55621,
yRtx56xl-70,Real Engineering,2022-05-20 12:00:23+00:00,Why SpaceX is Using a New Fuel,2174137,3049,67199,
SUdHzKRiBX8,Real Engineering,2022-04-30 13:00:22+00:00,The Insane Engineering of the Javelin,5700273,9895,150774,
wHKJntXF5do,Real Engineering,2022-04-09 13:30:18+00:00,Has Russia’s War Doomed The International Space Station?,1239074,4150,39152,
hnrpXxbVhME,Real Engineering,2022-03-26 15:00:20+00:00,The Insane Engineering of the Concorde,2536274,2240,56282,
pOZhPz92Dic,Real Engineering,2022-02-19 15:00:20+00:00,The Insane Engineering of the Parker Solar Probe,3684486,5511,86343,
aznOL753eiQ,Real Engineering,2022-01-23 15:00:00+00:00,The Truth About Carbon Taxes,615549,4519,32893,
aICaAEXDJQQ,Real Engineering,2021-12-18 17:09:48+00:00,The Insane Engineering of James Webb Telescope,7989439,11054,169555,
F0y8hV2kfJc,Real Engineering,2021-11-27 17:00:03+00:00,Will Boom Bring Supersonic Back?,841488,2111,30494,
GIGlQBx4tys,Real Engineering,2021-11-20 15:00:07+00:00,The Insane Engineering of the Thunderscreech,3831244,2774,90535,
7OpM_zKGE4o,Real Engineering,2021-10-23 13:00:08+00:00,The Problem with Solar Energy in Africa,7497612,15971,145393,
Sf6H8kSunRA,Real Engineering,2021-10-09 13:00:14+00:00,The Insane Engineering of the GEnX,4985759,4243,104418,
lapFQl6RezA,Real Engineering,2021-10-03 13:00:18+00:00,The Insane Engineering of the 787,5939495,4445,122925,
uO4FckCAZtU,Real Engineering,2021-08-28 12:00:31+00:00,This Is Not a Shockwave,610498,923,31652,
59A8-rKRs-0,Real Engineering,2021-08-02 11:00:02+00:00,The Plane That Will Change Travel Forever,4213823,4773,98902,
C_BK7PRugK4,Real Engineering,2021-07-04 12:00:03+00:00,The Uncertain Future of Jet Fuel,1265170,3994,46553,
OpEB6hCpIGM,Real Engineering,2021-06-05 14:00:25+00:00,The Problem with Biofuels,1988112,10024,89963,
SIif11QOsRI,Real Engineering,2021-05-08 15:00:08+00:00,How Carbon Nanotubes Will Change the World,2046954,2585,66467,
MMLgJlJX0Rk,Real Engineering,2021-04-17 13:00:07+00:00,Can Nuclear Propulsion Take Us to Mars?,4551784,4905,96444,
7zR26e504uI,Real Engineering,2021-03-31 13:30:00+00:00,The Insane Engineering of the X-15,7900219,4727,123206,
sJdYAsnvQo8,Real Engineering,2021-02-24 18:14:58+00:00,The Hidden Code in the Mars Landing #shorts,27295703,8399,1290487,
JSgd-QhLHRI,Real Engineering,2021-02-20 15:30:01+00:00,The Truth About Pumped Hydro,1115140,5526,43354,
yqqaW8DCc-I,Real Engineering,2021-02-18 14:05:03+00:00,The Insane Engineering of the Perseverance Rover,5237976,7175,135070,
SpiMXHgItHg,Real Engineering,2021-01-23 15:00:16+00:00,NASA's Weirdest Experimental Plane,989860,1198,34865,
-PL32ea0MqM,Real Engineering,2020-12-30 15:00:00+00:00,The Missing Link in Renewables,2162004,4283,68634,
wr7QZ364jPY,Real Engineering,2020-12-12 17:00:10+00:00,How Big Can Wind Turbines Get?,936802,2543,38812,
WWiX2edcBoA,Real Engineering,2020-11-24 19:30:02+00:00,Are Renewable Powered Ships Possible?,838860,4478,38283,
1Xwxe0wU4b8,Real Engineering,2020-10-24 13:00:00+00:00,Tesla's Battery Supply Problem,1509387,3877,49404,
zpFLLGkNm7I,Real Engineering,2020-10-10 14:00:15+00:00,The Floating Harbors of D-Day,918611,1139,35272,
yVOnHWnLSeU,Real Engineering,2020-09-26 12:00:16+00:00,The Mystery Flaw of Solar Panels,3547442,4631,98905,
hid7EJkwDNk,Real Engineering,2020-08-15 12:00:20+00:00,Is The Metric System Actually Better?,2577586,36683,135168,
IwqTN5fhMR8,Real Engineering,2020-08-01 11:02:03+00:00,The Insane Engineering of the P-47 Thunderbolt,3630464,8724,93580,
Xa_xteu_Mts,Real Engineering,2020-07-18 12:00:11+00:00,Are Space Elevators Possible?,1450946,3510,50755,
obcya0ze6Zo,Real Engineering,2020-06-20 12:30:10+00:00,Titanium - The Metal That Made The SR-71 Possible,2580464,2331,60966,
UC_BCz0pzMw,Real Engineering,2020-06-06 12:00:07+00:00,The Economics of Nuclear Energy,1888871,6988,65403,
wk6Qr6OO5Xo,Real Engineering,2020-05-23 12:00:22+00:00,The Insane Engineering of the A-10 Warthog,18317542,15880,266566,
g-gGeAe-PJA,Real Engineering,2020-05-09 13:36:20+00:00,The Truth About 5G,3688098,19470,116457,
3hYSnyVLmGE,Real Engineering,2020-04-18 13:00:05+00:00,The Insane Engineering of the SR-71 Blackbird,9333948,6491,158088,
7vLPefHYWpY,Real Engineering,2020-04-04 13:14:19+00:00,A Guide To Designing Low-Cost Ventilators for COVID-19,749819,2263,42133,
sYXYG_F1EK0,Real Engineering,2020-03-28 14:30:09+00:00,Why Was Normandy Selected For D-Day?,1857465,2129,46704,
k8_SbVg5Ris,Real Engineering,2020-03-14 13:00:09+00:00,Will New York Be Underwater by 2050?,505702,1555,18760,
gacGuWjqKco,Real Engineering,2020-02-29 13:00:07+00:00,Is 100% Renewable Possible By 2050? - Interconnectors,700648,3161,28894,
dmPvGi4s9bg,Real Engineering,2020-02-15 15:00:08+00:00,Which Is The Most Dangerous Car?,1787341,4033,55571,
85aFTVijEc8,Real Engineering,2020-01-25 15:00:04+00:00,The Real Flying Saucer,1567368,1718,31437,
Hw67Hus6gIY,Real Engineering,2020-01-11 13:00:03+00:00,Why Elon Musk Created Neuralink (feat. Real Science),1276232,3025,38789,
mXi7P8hrN4w,Real Engineering,2019-12-21 13:30:00+00:00,How Planes Survive High-Gs,1774988,1627,45765,
CIYA6Jwwp4s,Real Engineering,2019-12-07 13:00:02+00:00,Can Underwater Turbines Solve Our Energy Problems?,2015405,3586,57136,
kkNGdzo_3EA,Real Engineering,2019-11-23 13:30:01+00:00,The World's Oldest Construction Project | Sagrada Familia,2456390,3503,65883,
I8iLR2xRNKY,Real Engineering,2019-11-10 13:00:03+00:00,Why Does Wing Dihedral Make Planes Stable?,864668,932,26116,
fzBRYsiyxjI,Real Engineering,2019-10-26 12:00:08+00:00,The Material Science of Metal 3D Printing,2646702,2033,61708,
zDujFhvgUzI,Real Engineering,2019-10-12 12:30:02+00:00,Is The F-35 Worth $115 Million?,6350645,14709,103448,
LLO9WxVO9s8,Real Engineering,2019-09-28 11:00:04+00:00,The Grid vs. The Next Big Solar Storm,925660,1684,27213,
IJ-7H5GCNp0,Real Engineering,2019-09-21 11:00:03+00:00,M4 Sherman - The Workhorse of D-Day,1796769,3662,49994,
j8umNI8gtlA,Real Engineering,2019-09-14 11:00:07+00:00,How to Sail on Starlight,575375,793,18434,
vZLo0-lwK1k,Real Engineering,2019-08-31 10:00:11+00:00,Could Earth's Heat Solve Our Energy Problems?,1370119,3798,37823,
h6NsYyAUOHE,Real Engineering,2019-08-17 11:00:07+00:00,Why Fighter Jets Can Be Too Unstable,1901145,2188,50679,
wJuWuJBbc1s,Real Engineering,2019-08-03 11:00:19+00:00,NASA's Dragonfly Mission to Titan,2627161,3865,54474,
RN6vGxyMcVU,Real Engineering,2019-07-20 11:00:02+00:00,Why Do Backwards Wings Exist?,4969128,4605,109094,
7Hv2dsVkA38,Real Engineering,2019-06-29 11:30:00+00:00,The Soviet Superplane That Rattled America,4969351,3772,75700,
giQ8xEWjnBs,Real Engineering,2019-06-15 11:30:00+00:00,Why SpaceX is Making Starlink,7360097,15147,148721,
5cA9bZRHpZE,Real Engineering,2019-06-08 11:00:00+00:00,Why Are There so Many Types of Screws?!,2051010,4414,72718,
h5cm7HOAqZY,Real Engineering,2019-05-25 12:11:14+00:00,California's Renewable Energy Problem,1630533,10536,41277,
P8aTDusU7dw,Real Engineering,2019-05-10 12:00:06+00:00,The Challenge of Building a Self-Driving Car,824484,1657,28259,
itdYS9XF4a0,Real Engineering,2019-04-26 11:30:00+00:00,The Truth About Space Debris,2910773,4359,56950,
l-vHGf4j90Y,Real Engineering,2019-04-19 13:32:02+00:00,How Many Digits of Pi Do We Really Need?,654819,1992,27366,
9Jt924xjaJo,Real Engineering,2019-04-05 11:00:02+00:00,America's Insane Plan for Nuclear Powered Planes,2341474,2063,48687,
ecxCL84n26g,Real Engineering,2019-03-22 14:00:07+00:00,Carbon Capture - Humanity's Last Hope?,941780,4657,33219,
DE_PZQ13YTY,Real Engineering,2019-03-08 14:00:01+00:00,Tesla's Quest for Better Batteries,2673700,2244,47770,
kFFyeHJDI50,Real Engineering,2019-02-22 13:00:04+00:00,Designer Babies - The Problem With China's CRISPR Experiment,691314,2727,21246,
6AcE7hBhpYU,Real Engineering,2019-02-08 13:00:00+00:00,Why SpaceX Built A Stainless Steel Starship,4920224,5041,80662,
jEbRVNxL44c,Real Engineering,2019-01-25 14:30:02+00:00,Zipline - How Rwanda Built A Drone Delivery Service,1546317,3065,64135,
2hVEmBKdm1s,Real Engineering,2019-01-18 16:00:00+00:00,How The Ford Model T Took Over The World,695588,938,19772,
IorDYGI1uqc,Real Engineering,2018-12-28 13:00:03+00:00,Ion Propulsion - The Plane With No Moving Parts,4385666,4480,87499,
kMNSAhsyiDg,Real Engineering,2018-12-13 13:02:29+00:00,How Shazam Works,2716537,2062,86364,
lzRvSWPZQYk,Real Engineering,2018-11-30 13:00:05+00:00,The Truth About Vinyl - Vinyl vs. Digital,5611467,22204,109957,
52VQdt0-5EQ,Real Engineering,2018-11-23 14:00:00+00:00,Britain's Most Daring WW2 Raid,1646265,1657,39234,
tJFtdvrTZs4,Real Engineering,2018-10-26 11:30:04+00:00,Can We Block the Sun to Stop Climate Change,599153,3808,19125,
ALQ_RNSRE40,Real Engineering,2018-10-19 11:00:34+00:00,How Machine Learning is Fighting Cancer,337225,539,13413,
-dL28N5yPmQ,Real Engineering,2018-10-05 12:28:16+00:00,How We Will Colonise The Moon,959989,1718,30246,
2lv6Vs12jLc,Real Engineering,2018-09-22 09:48:36+00:00,How NASA Reinvented The Wheel - Shape Memory Alloys,5057429,4508,102547,
lfo8XHGFAIQ,Real Engineering,2018-09-14 11:30:01+00:00,Can We Terraform the Sahara to Stop Climate Change?,2880723,15951,72223,
X0Mu4jJ0S0s,Real Engineering,2018-08-31 11:00:08+00:00,The Rise and Fall of the Japanese Zero,5607248,6073,96998,
Rbt2NFCtBh4,Real Engineering,2018-08-24 14:00:07+00:00,Why The US Airforce Ejected a Bear,978526,1205,22920,
5QZ3eozyQfU,Real Engineering,2018-08-10 12:00:00+00:00,Designing the Perfect Airport Runway,3224989,2305,58244,
f7MzFfuNOtY,Real Engineering,2018-07-27 12:29:48+00:00,The Truth about Hydrogen,5623410,20813,101010,
VNvzZfsC13o,Real Engineering,2018-07-20 12:30:03+00:00,Are Electric Planes Possible?,2313810,5863,54059,
Xz8RRxYwrhg,Real Engineering,2018-07-10 12:30:21+00:00,The Physics of Racing Games,530863,1063,16906,
CkOOazEJcUc,Real Engineering,2018-06-22 13:31:34+00:00,NASA's 150 Million Dollar Coding Error,853009,684,20939,
n3n0gKLn84k,Real Engineering,2018-06-08 11:30:00+00:00,The WW2 Towers That Defeated the Soviets,3188419,5274,76192,
o6XlcarjqAw,Real Engineering,2018-05-25 13:30:01+00:00,How to Solve the Housing Crisis,972592,2987,30269,
N52XEh2qhnU,Real Engineering,2018-05-21 12:30:00+00:00,Cyborg Hearts - How Humans Computerised The Heart,307639,620,11691,
ahX_0XHp1vM,Real Engineering,2018-05-04 11:05:19+00:00,How to Find an Exoplanet,336883,818,12030,
saCdvAp5cow,Real Engineering,2018-04-13 11:31:52+00:00,How a Single Swedish Submarine Defeated the US Navy,10019922,15358,148590,
zZ_jGGD-DX8,Real Engineering,2018-03-09 14:39:53+00:00,Why Planes Crash.,1701092,2739,39285,
iOVg62_DUYU,Real Engineering,2018-02-23 08:23:47+00:00,The Truth About Wireless Charging,4474078,4659,104247,
Ua2_IR2CkZU,Real Engineering,2018-02-09 15:30:25+00:00,Fastest Car vs. Fastest Helicopter - Which is Faster?,969473,1411,25302,
6jQ4y0LK1kY,Real Engineering,2018-01-29 15:01:00+00:00,Heat Treatment -The Science of Forging (feat. Alec Steele),3302561,1555,87812,
4GfqB7P6uAE,Real Engineering,2018-01-12 13:00:16+00:00,The Real Life Sci-Fi of Vertical Take-Off Planes,2383304,2520,56979,
lA9g7fDWnok,Real Engineering,2017-12-29 12:32:11+00:00,The History of The London Underground,620650,585,16764,
oJ8Cf0vWmxE,Real Engineering,2017-12-15 14:08:27+00:00,The Truth About The Tesla Semi-Truck,3960543,10138,90519,
mPshhkYpCBY,Real Engineering,2017-11-24 12:30:02+00:00,Designing The Fastest Wheels in History,2040422,3418,45533,
Ney1poEzLao,Real Engineering,2017-11-17 13:55:16+00:00,"The Rise of Samsung, Apple's Secret Supplier",1526682,1689,31954,
i6DRRHXt-PA,Real Engineering,2017-10-31 14:30:03+00:00,Why The Netherlands Isn't Under Water,3610104,3884,69551,
aAqZ44C0j5k,Real Engineering,2017-10-27 12:30:00+00:00,The Mystery of the Pyramids' Construction,1603031,1849,38015,
2HcqS508lIo,Real Engineering,2017-10-13 12:30:00+00:00,The US Military's Most Powerful Gun,3717293,3183,65937,
4xbFVdoRzLQ,Real Engineering,2017-09-29 12:30:00+00:00,How To Stop A North Korean Nuclear Missile,1078919,1500,27682,
_X5VHl0eMTk,Real Engineering,2017-09-25 10:14:19+00:00,Area Rule: How To Make Planes Fly Faster,498789,990,14614,
A00QWVHem3A,Real Engineering,2017-09-08 12:30:00+00:00,Why North Korea Can't Build An ICBM (yet),1891586,2749,37250,
dIjRZ8aNy4I,Real Engineering,2017-08-21 12:30:00+00:00,Why 2017 is the Fastest Year in Formula 1 History,1700906,1991,33735,
ahxBbEwhIE0,Real Engineering,2017-08-08 12:30:31+00:00,How Many Batteries Could Power The World? (ft. MinutePhysics),591133,1389,15858,
AQdrbepn3pE,Real Engineering,2017-07-19 12:15:53+00:00,Are There Parts of German WW1 Warships in Space?,604458,512,14067,
ozAPGnr-934,Real Engineering,2017-06-19 11:00:07+00:00,Why The US Military Made GPS Free-To-Use,4670336,5938,107829,
HUgV8_meyo8,Real Engineering,2017-05-27 12:30:01+00:00,How Russia Stopped The Blitzkrieg,7495909,14254,134954,
R43gKMWAPco,Real Engineering,2017-05-15 11:00:02+00:00,Boom: The Future of Supersonic Flight?,1477131,1489,29992,
MI08NGCgISE,Real Engineering,2017-04-29 12:30:09+00:00,The Physics of World War 1 Planes feat. The Great War Channel,1772952,1222,40198,
H7Z04Tl1-1Q,Real Engineering,2017-03-31 13:22:30+00:00,The Future of Airliners? - Aurora D8,3004188,2815,52377,
xRbOiNNy030,Real Engineering,2017-03-21 14:38:02+00:00,What's The Biggest Machine In The World?,1471927,1887,32700,
aKpDyfJnxQQ,Real Engineering,2017-02-27 13:03:45+00:00,Carbon Fiber - The Material Of The Future?,1433769,934,35414,
7-I20Ru9BwM,Real Engineering,2017-02-02 13:32:01+00:00,Why Are The Dreamliner's Windows So Big?,1442982,1296,29961,
4NG3qZHx1jM,Real Engineering,2017-01-16 15:21:41+00:00,The Greatest Innovations In Formula One,3335431,2374,57996,
7E__zqy6xcw,Real Engineering,2016-12-21 16:59:14+00:00,The History of Iron and Steel,1473986,1194,41365,
zSz0kV0BPDY,Real Engineering,2016-12-08 12:52:49+00:00,Why Are I-Beams Shaped Like An I?,1056677,1060,26995,
3qLsPHz_Hr8,Real Engineering,2016-11-21 13:00:00+00:00,Why Build Higher?,1662048,3064,45874,
niVguabIhTs,Real Engineering,2016-10-25 13:24:38+00:00,Burj Khalifa - How To Build Higher,1963048,1199,46546,
BHZALtqAjeM,Real Engineering,2016-10-06 11:52:25+00:00,Material Properties 101,1315289,563,33383,
OwS9aTE2Go4,Real Engineering,2016-09-12 12:30:00+00:00,Transistors - The Invention That Changed The World,5581571,5123,155491,
yn9qhQSMCRk,Real Engineering,2016-08-24 12:52:44+00:00,Aluminium - The Material That Changed The World,1448614,992,37708,
YzRlga2-Hho,Real Engineering,2016-08-03 12:53:22+00:00,The Spitfire's Fatal Flaw,5941350,7782,97801,
txLmVpdWtNc,Real Engineering,2016-07-18 12:30:01+00:00,How Will SpaceX Get Us To Mars?,2064990,3193,67739,
im-JM0f_J7s,Real Engineering,2016-06-29 12:30:01+00:00,Can We Create Artificial Gravity?,3263679,5925,68490,
fsXpaPSVasQ,Real Engineering,2016-06-15 12:30:01+00:00,Steam Engine - How Does It Work,2261110,783,31802,
ya8umwgtsLw,Real Engineering,2016-05-24 13:00:02+00:00,Stealth - How Does it Work? (Northrop B-2 Spirit),4034284,3382,77293,
FNqXf6t7e-w,Real Engineering,2016-05-10 13:00:00+00:00,Winglets - How Do They Work? (Feat. Wendover Productions),1272286,485,19934,
