video_id,channel_title,video_publish_date,video_title,video_view_count,video_comment_count,video_like_count,video_dislike_count
RNPIRfxUTQ4,Real Engineering,2016-04-22 10:34:57+00:00,Why Do Wind Turbines Have Three Blades?,2679769,1597,43488,
DnmPcJ6OiBg,Real Engineering,2016-03-24 13:57:27+00:00,Hyperloop - The Future of Travel?,619794,1195,10255,
GXFpLnPpDtY,Real Engineering,2016-03-01 10:00:00+00:00,Why Are Airplane Wings Angled Backwards??,1457476,982,24954,
WCPapu78SNM,Real Engineering,2016-02-02 07:27:08+00:00,Wright Brothers Didn't Invent Flight,371475,1769,7534,
7rXGRPMD-GQ,Real Engineering,2016-01-10 05:33:44+00:00,Why are plane windows round?,1869287,427,15180,
hUhr-2eiKmE,Real Engineering,2015-10-05 10:47:05+00:00,What is Real Engineering?,128724,227,5232,
